,Unnamed: 0.2,Unnamed: 0.1,Unnamed: 0,place_id,user_id,score,comment
0,0,0,0,돋질산,y,5.0,"울산이 공업도시 되기전 최고의 주변경치를 볼수있는 곳. 산, 강, 바다, 울산만 한번에 볼수 있음. 이병철 회장이 이곳에 별장짓다, 준공하지못하고 흉물스럽게 방치되다 철거 됨. 동쪽은 60년대 한국비료공장(현, 롯데정밀화학, 노무현 전대통령 막노동). 서쪽 삼산동 현대백화점~남구청 일대는 일제시대 후쿠오카행 쌍발비행기가 이착륙하던 울산공항이 있던 삼산평야. 주변 화학 냄새가 독함."
1,1,1,1,돋질산,정광현,5.0,
2,2,2,2,돋질산,게로른로,5.0,승천하지 못한 이무기가 또아리를 틀고 사는 산이라 했다여름철 이무기가 울면 태화강에 사람이 빠져 죽었다고 했고 겨울철에는 꽝꽝 언 태화강 얼음이 깨져 또 사람이 빠졌다는 이야기가 내려 온다 빠지는 사람은 인근 마을 사람이 아닌 객지인들 이었다 한다 하여 인근 마을 사람들은 이 시기에 객지 사람이 오면 강에 얼씬하지 못하도록 하였다돋질산 중턱에 이무기가 머무는 중간에 당시 중정부장이었던 이후락씨의 별장을 지으려 했으나 사고가 끓이지 않아 짓다만 건물이 볼썽 사납게 남아 있었다얼마전 이십여년 만에 들러본 울산 내황초등학교에서 본 산은 변하지 않은 듯하여 반가웠다
3,3,3,3,돋질산,Achtung Bae C,1.0,
4,4,4,4,돋질산,NAMU,5.0,산 정상 뷰가 크으으으.....  죽습니다 죽어
