place_id,user_id,score,comment,Unnamed: 0.3,Unnamed: 0.2,Unnamed: 0.1,Unnamed: 0
울산대공원,송현호,5.0,가족들과 오손도손 이야기하며 걷고 다양한 체험도 할 수 있어 정말 좋았다,,,,
울산대공원,Robert Shin,5.0,"가깝고 다양한 체험행사와 수영장, 몰놀이장, 장미원, 동물원, 과학관 등이 있어 아이들이 좋아함",,,,
울산대공원,산인,5.0,메티세콰이어길도 있고현충원도 있는 공기 좋은 공원,,,,
울산대공원,amom a,4.0,"아이들이놀고즐길수있는 공원입니다
근처커피숍 맛집이많이있어요",,,,
울산대공원,백종완,5.0,울산이 자랑할만한 아름답고 속이 뻥뚤리는듯한 공원,,,,
울산대공원,태교 명상 그리고 숙면,5.0,19.12.20~20.1.27까지 울산대공원 정문에서 빛축제 합니다. 버스킹 공연과 가수들도 오니 많이들 구경오세요 야경도 너무 이뻐요^^,,,,
울산대공원,이주애,4.0,"산책하기좋고  자전거 타기도 좋고
놀이터도 있어서 아이들과 함께하기 좋은 장소에요",,,,
울산대공원,Turtle HAN,5.0,갈때마다 기분이 좋습니다. 울산대공원 관계자분들 감사합니다.,,,,
울산대공원,귀욤까까,5.0,너무나도 아름다운 우리 울산의 자랑이라 할 수 있는 울산대공원! 너무나도 좋은 곳 입니다!ㅎㅎ,,,,
울산대공원,vulgoki vgk,4.0,"산책, 운동하기 좋음~ 접근성도 좋아요~",,,,
울산대공원,황준석,5.0,울산 최고의 야경 나들이 공원이에요..얼릉 다녀오세요,,,,
울산대공원,루나,5.0,"경치좋고,공기좋고,운동을 하기는 좋은장소...1월27일까지빛축제.",,,,
울산대공원,Sarah Lee,4.0,"울산 여행 갔다가 들른 곳 입니다
전체를 다 보진 못했지만
좋은 기억이었어요",,,,
울산대공원,김명화,5.0,"도심가까이있어서  산책과
힐링할수있는  숲이 쾌적함",,,,
울산대공원,마스타고치기,5.0,"매년 열렸다고 하는데 올해 처음으로 갔네요
너무 예쁘요
꿀꿀했던 기분도 아주 좋아지게 해요…",,,,
울산대공원,양정숙,5.0,"친구랑  운동하다 우연히  들른 곳  시민건강센타에서  임바디  측정서비스도  받고
센타장님과 셀카도 찍고 친절히 설명해주시는 센타직원분께도 감사드려요♡♡♡",,,,
울산대공원,김동중 Kim Dong Jung (경주김가),4.0,이쁜 꽃도많고 좋아요~^^,,,,
울산대공원,김찬우,5.0,"울산 시민의 쉼터 도심에서 가까운 공원
지금은 가을을 느끼기에 좋은곳",,,,
울산대공원,이정환,5.0,도심속에 자연과 함께 할수 있는 휴식 공간,,,,
울산대공원,Dae Hyeon Kim,3.0,아이들 데리고 자전거나 킥보드 타기도 좋고 소소한 행사들도 하고.. 좋아요,,,,
울산대공원,정구지,4.0,도시중심에 위치하며  잘 정돈된 나무며 산책하기좋은 울산 제1의 공원입니다,,,,
울산대공원,셀바이,5.0,울산시민이 정말 편하게 쉴 수 있는 공간 울산대공원 입니다. 넓고 다양한 공간이 준비되어 레크레이션과 공연을 즐기 수 있습니다.,,,,
울산대공원,권연수,5.0,"사계절 축제가 있고, 낭만과 즐거움이 있는곳
깨끗한 환경과 체험을 즐길수있음..",,,,
울산대공원,김Zero,5.0,"너무 아름다운 자연경관과 함께 살아간다는 사실에 너무 감사해요,!",,,,
울산대공원,강미연,5.0,"넓고 곳곳에 자판기도 있고 놀이터도 있고 걷기도 좋아요. 다만 자전거 타는사람들이 많아서 주의를 해야합니다
동물원이랑 장미정원 가실분들은 남문에서 주차하시길... 정문에서 겁나 걸어야 해요",,,,
울산대공원,이선영,5.0,"가까운 시내에 이런 곳이 있어서 행복함. 지금은 빛축제중이라 밤이 정말 아름다움.
1월후반기까지니 자주 가야겠음",,,,
울산대공원,김태은,5.0,도심안의 공원에 이런 행사가 너무 좋다,,,,
울산대공원,Jabin Kim,5.0,가족 나들이나 밤마실가기 좋아요,,,,
울산대공원,빈쭌,5.0,아이들과 놀기좋은곳이 많아요,,,,
울산대공원,강호,5.0,가까운 곳으로 연인과 또는 애들과 가기 좋은곳 같아요. 가볍게 나들이 좋아요,,,,
울산대공원,신은희,5.0,"집근처라 자주 가는곳입니다
조카들이오면 더할나위없이 좋아하는곳이구요
이번에도 자전거타고 물놀이터가서 신나게 놀았네요",,,,
울산대공원,장태진,5.0,도시속 공원 정말 좋아요,,,,
울산대공원,휴tv산과여행,5.0,장미축제 최고예요,,,,
울산대공원,Oats Sung,5.0,적당한 나이의 아이들과 가서 자전거타기 좋음요,,,,
울산대공원,Junpil Hwang,5.0,경치도 보기좋고 걷는코스도좋아요,,,,
울산대공원,Alex Kim,4.0,"도심 가운데 있어 접근이 좋고 넓고 편안히 산책이나 휴식할 수 있다.주변에 카페와 맛집과 일반 식당들도 많다.
공원 내에는 자전거대여소,헬스센터,수영장,동물원,장미원,현충탑 등의 시설과 호수.대형 옥외공연장,놀이터 등이 있다.
잉어 연못도 있다.",,,,
울산대공원,chaeseok lee,5.0,울산의 자랑 ULSAN GRAND PARK 무료입장에 휴식과 힐링장소로 아주 좋아요.,,,,
울산대공원,텔라하루,5.0,국화꽃이 예쁘게 펴서 좋았어요,,,,
울산대공원,deok je son,5.0,가을이 예뻐요,,,,
울산대공원,HyeRa Lee,5.0,날씨도 좋고 공원도 예뻐서 데이트하기 좋을듯.합니다,,,,
울산대공원,끼리라,5.0,메타세콰이어길 걸으러 갔었어요. 엄청넓어서 지도보고 걸어야될정도였습니다. 주말에 놀러가기좋은곳이였습니다.,,,,
울산대공원,Seung-yul Vin,5.0,산책하기 좋음,,,,
울산대공원,Mi Rim Lee,5.0,공기좋고 바람좋고 넓어서 자전거타고 다니기좋아요~,,,,
울산대공원,Vau Đen,3.0,"옆에 델문도 까페에서 맛있는 빵이랑 커피도 드시구요,",,,,
울산대공원,Jessica Jang,4.0,좋아요. 가을인데도 장미꽃이 꽤 펴있네요.,,,,
울산대공원,쓰울갈매기,5.0,"산책하기 너무 너무 좋은 곳.
개와 자전거 조심",,,,
울산대공원,Yuji Li,5.0,너무시원하구 깨끗해요,,,,
울산대공원,Enfnal Seo,5.0,"매우 아름다운 시민공원이다.
동,식물원도 있다.",,,,
울산대공원,조봉순,5.0,엄마 모시고 걷기에 참 좋았어요 훨체어도 대여해 주어 어르신 모시고 나들이 잘하고 왔어요,,,,
울산대공원,최정은,5.0,빛 축제중~  운동하기 좋아요~^^,,,,
울산대공원,최욱철,5.0,너무 이뻐요~^^,,,,
울산대공원,김태환,4.0,어린 가족과 함께 오면 좋아요,,,,
울산대공원,채송화,5.0,♡최고의 휴식처♡,,,,
울산대공원,김동규,3.0,아이들과 가기엔 좋은곳 but 연인과가기엔 조금 미흡??,,,,
울산대공원,이정욱,5.0,자연을 즐기고 산책하기 좋아요,,,,
울산대공원,콩만이,5.0,"오랜만에 산책삼아 갔는데 날이 따뜻해서 좋았고
다음번에는 아이와 함께 가려합니다^^",,,,
울산대공원,최순호,5.0,장미축제 이틀째 주차공간아 없어 힘들었네요~,,,,
울산대공원,Min gyu Jo,5.0,빛축제중이라서 볼것이 많습니다.2020년 1월27일까지 울산대공원 빛축제~~,,,,
울산대공원,boribori,5.0,넓은 공원에 많은 나무와 호수 그리고 시설이 잘되어있다,,,,
울산대공원,오늘도달리자,4.0,"아쿠아시스 수영장 정말재미있었어요
그런데...매점이 조금아쉬웠어요
닭꼬치가4천원대 라면6천원은..쫌 그러네요",,,,
울산대공원,그냥햄스터,5.0,"넓고 산책 굿
야경이 제일좋으니 밤7시쯤 가시길.",,,,
울산대공원,이승희,4.0,"울산대공원 정말 넓고 볼거리도 많고, 장미원 동물원도 너무 잘되어있었어요
근데 남문휴게점 일하시는분 불친절하시네요
손님인데도 본인 에어컨 쐬는거 방해되느라 싫으신가봐요ㅋㅋㅋㅋㄱ
다들 알고ㄱㅏ셨음좋겠네요",,,,
울산대공원,Stone LEE,4.0,"부산에도 가까이 이런 곳이 있었으면 한다.  아침 일찍 운동하는 사람들과  산책하는 분들로 약간은 번잡해 보이지만,  조용하고 볼거리도 다양했다.",,,,
울산대공원,정혁준,5.0,"오랜만에 갔는데 좋았습니다.
시설관리도 잘되어있고 산책하거나 놀기 좋아요",,,,
울산대공원,김은영,4.0,아기랑 산책하기 좋았고 잘되있었어요~담엔 동물원도 가봐야겠어요^^,,,,
울산대공원,정옥선,5.0,사철내내 모던하고 아름답고 예뻐요 시설관리 공단의 관리능력이 최고입니다 강추 합니다,,,,
울산대공원,천진순,5.0,"최고에 공원이죠.산책,운동 하기에도 좋구여.코로나땜에 여기서들 만나서 운동도 하고 커피를 마실수있는 최적에 장소지요.밤에는 또다른 야경을 볼수있지요.데이트 하기도 좋고 아이들과 같이 뛰어놀수도 있고 진짜 좋아요.짱이랍니다~",,,,
울산대공원,byeongsu kang,5.0,지속적인 개발 관리가 산책하기 좋아요,,,,
울산대공원,배선영,5.0,산책하고 북까페 가서 책 읽으며 커피도 마셨어요. 공원에 나무로 재활용 해놓은 나무 조형물들이 여러개가 있었는데 귀엽기도 하고 밤에 보면 무섭기도할것 같아요~ㅋㅋ,,,,
울산대공원,Huije Lee,5.0,"최고의 김밥집. 적극추천합니다.
사장님 친절하시고 합리적 가격에 맛잇어요",,,,
울산대공원,망부석티비,5.0,지금 1월말까지 빛축제하고 있습니다. 밤에 오셔서 사진 찍으면 정말 예술입니다.^^ 주말에는 공연도 있으니 꼭 오셔서 놀다가세요~~~!!!,,,,
울산대공원,Seungyoul Han (여천천걷기),4.0,공원과 솔마루길이 얽혀있는 멋진 곳이죠. 울산의 보물입니다.,,,,
울산대공원,조선영,5.0,대규모 공원으로 울산 시민의 휴식처!,,,,
울산대공원,새롭게,5.0,봄이 참 아름다운 곳!,,,,
울산대공원,박영기,5.0,가족 연인과 산책하기 좋습니다.,,,,
울산대공원,미지의 효도이 HYODOI,5.0,"세상 넓고 볼거리 많은 곳이예요, 재방문 하게 된다면 좀 더 여유롭게 구경하고 싶은곳",,,,
울산대공원,고봉수,5.0,꽃과 대나무가 넘 좋아요,,,,
울산대공원,성민수,5.0,산책이나 운동하기 아주 좋은 곳 입니다.,,,,
울산대공원,꿈이큰사람,5.0,한가롭게 산책할수있는곳.  사계절 다 아름다운 울산대공원,,,,
울산대공원,김태현,5.0,생각보다 넓고 관리가 잘 되어 있어서 좋았음,,,,
울산대공원,Snghoon Park,5.0,오랜만에 방문했어요. 기억 속 어렸던 가로수들이 참 많이 자랐네요. 터널처럼 그늘이 만들어져서 너무 좋았어요.,,,,
울산대공원,JHyuk C,5.0,추억의 공원. 언제 가도 좋아요 :) 사람 되게 많음. 이제 놀이터도 오픈했어요,,,,
울산대공원,울산천사,5.0,운동하기 너무좋아요,,,,
울산대공원,구기모,5.0,"무료라서 좋아요. 주차장도 넓고 산책하기에 너무 좋습니다.
가운데 호수가 참 좋아요.
다음에는 야간에도 꼭 가보고 싶네요.
근처에는 스타벅스와 식당들이 있어서 식사나 차한잔 하기에도 좋습니다.",,,,
울산대공원,김하영,5.0,"아이들과 산책겸 덥지도 춥지도 않은 날씨에 다녀왔어요.
어린아이들이 있다면 놀이터도 좋네요.
저희애들은 큰애들인지라 놀이터에서 놀순없었지만 대공원 안에 북카페가 있어서 거길 이용해도 좋겠어요.…",,,,
울산대공원,홍주리,4.0,아침에본 문수공원이랑  저녁에본  울산대공원이랑 분위기가틀려요  걷기좋고  운동하기 좋고 자전거도 오전9시부터 공원안에서  빌려탈수있더라구요  삼천원이구요 1시간에  .. 빌린장소는 정문 동문쪽에  비치되어있더라구요.  연인들끼리  둘이탈수 있는 자전거도있더군요.ㅋㅋㅋ 볼거리도 다양해요,,,,
울산대공원,Soi Kim,5.0,"반려견과 산책하기 좋고
놀이터와 농구장이 있어서 아이들이 놀기좋고
곳곳에 분수대와 호수 그리고 풍차가 있어서 사진찍기좋고…",,,,
울산대공원,S S,4.0,넓고 볼거리가 많아서 산책하기 좋은 곳 입니다. 야경도 잘되어있어서 밤산책 코스로도 추천드려요,,,,
울산대공원,아쿠아비테(AquaVitae),3.0,"울산은 아직 눈이 내리지 않아서 늦게나마 가을 보내주기 하려고 아이와 둘이 산책하면서 사진찍는 데이트하고 옴
울산에 8년을 살아도 이곳에 올 일이 잘 없어서 그런지 나가는 입구를 몰라서 고생함...ㅋㅋㅋ 동문으로 들어와서 정문으로 나가는데 거리가 꽤 멀던데  표지판을 중간에 한번 본거같음 안내가 잘 안되있는거 같고 아쉬웠는데 늦게나마 이쁜 사진을 찍을 수 있음에 위안을 삼아봄",,,,
울산대공원,문화재•여행Expert진재소장,5.0,"정말 넓고 가볼 곳들이 많은 훌륭한 장소입니다. 공원 조경도 훌륭하고 풍치도 있습니다.
어린 자녀들을 데리고 하루를 보내기에 최고의 장소인 것 같습니다. 또 찾아갈 예정입니다.",,,,
울산대공원,최석정,4.0,"2020년 1월 울산 겨울여행시 밤에 방문.
빛 축제(?) 같은 것을 함.
연인, 가족들이 산책이나 데이트로 많이들 방문.
울산 시내에서 가까워서 찾아가는 길은 어렵지 않다.",,,,
울산대공원,방울이,1.0,"빛축제??? 겁나게 추운날 울산대공원 빛축제 보러 갔다가 엄청 실망 했네요!!! 이걸 보려고 안간다는 애들이랑 아빠를 끌고 갔다가 엄청 실망하고 엄청 욕먹는 그런날이 되버렸네요!!! 이걸 볼려고 왔나 할정도로 실망만 했습니다.  울산대공원 정문 호수 둘레 빛축제 끝!!! 다른 곳에는 없어요 어이가없네!!
원망에 눈초리만 받으면서 집으로 왔네요!!!",,,,
울산대공원,민보현,5.0,"커피도 맛있고 빵이 너무너무 맛있는 맛집이었어요^^ 주말오전 기분좋게 시작했어요~
분위기도 우드느낌의 창이 커다랗게 나있어서 쾌적했어요❤",,,,
울산대공원,김춘희,5.0,"다른지역에 사는데 아이들 데리고 너무 재밌게 보내고 왔네요
놀이터가 많아 좋았어요~",,,,
울산대공원,YeongIn Kwon,5.0,"자주 가는 공원입니다. 가을에는 예쁜 단풍을 볼 수 있어서 더 좋습니다. 아이들이 놀수 있는 키즈테마파크,  뜀동산, 놀이터 등 다양한 테마로 구성되어 있습니다.",,,,
울산대공원,여행하는흰둥이,5.0,비오는 날에도 좋은 울산대공원 정문. 우연하게 들어갔는데 천장이 막혀있어 짧은 산책이라도 할 수 있어서 좋았다. 비그 그치고 한바퀴. 언제와도 좋은 울산 대공원이다.,,,,
울산대공원,Hyun Ha (Doori),4.0,넓어서 좋고~~산책 하기 좋아요~~하룻동안 거닐수 있고 다영하게 구경거리도 많으네요,,,,
울산대공원,SANGHO LEE (Shawn),5.0,주차편해요 근처 먹거리 마실거리 많아요 볼거리   즐길거리 충분하고 다돌아보려면 두세시간 걸려요,,,,
울산대공원,설탕공장,5.0,조용하니 넘 좋아요~ 식사후 산책했는데 힐링하고 가네요!,,,,
울산대공원,장지태,5.0,"넓은 광장, 수려한 수목, 운동 산책하기 좋네요",,,,
울산대공원,박다원,5.0,"2021년 올해도 장미축제는 취소되었더라구요. 요즘 길에봐도 장미꽃이 만발이길래,울산대공원 장미원이 생각나서 어제(21.05.23)구경갔어요. 만개해서 너무 이뻤어요. 장미원과 동물원 같이 있어요.아이들 동물원구경 좋아하드라구요. 공작새 너무 이뻐요.
입장료는 어른2000원 어린이500원입니다.…",,,,
울산대공원,김남숙,5.0,"잘 정돈된 공원에 산책하기도 좋고 기분 전환하기에 정말 좋아요.평일이라서 북적거리지 않고 벚꽃이 만발한 가운데 튜립까지 예쁘게 꾸며져 있어서 화사한 꽃이 더 돋보이고 예쁘네요.
아이들 어릴 때 많이 다녀간 곳이었는데 지금도 가족들 단위로 다녀들 간답니다.
동물원도 있고, 5월에는 장미꽃도 많이많이 피어서 장미원도 있답니다.",,,,
울산대공원,이현진,4.0,저녁에 걷기위해 갔어요 정문입구 주차하구요 대공원은 무료 입장입니다,,,,
울산대공원,에릭,5.0,"2002년 한일월드컵 직전 준공된 울산대공원
입구 근처에 있는 인공호수 분수대가 인상인 장소",,,,
울산대공원,울산바비,5.0,돌아보면서 걷기에 매우 좋은 장소입니다.너무 넓어서 많이 걷게되는게 장점일지 단점일지는 모르겠지만 볼거리가 많아서 너무 좋아요~^^,,,,
울산대공원,하야부사Delivery,5.0,"넓고 이쁘게 잘 꾸며놓은 공원
자전거도 대여해서 탈수 있게 해놨다!
봄,가을에는 어떤 모습일지 궁금하다",,,,
울산대공원,우연히여기,5.0,자전거도 탈수잇고 여름에는 실내수영장 아이들놀기좋은  놀이터  가족이 도시락싸서 아이들과 방문해도 좋은곳 추천합니다,,,,
울산대공원,김덕용,5.0,불빛축제 장소를 정문으로 옮긴 후 처음으로 갔는데 장미원보다는 괜찮았네요. 장소가 넓으니 사람이 많아도 부딪치는거없이 편안하게 구경하고 왔네요. 1시간이면 구경 끝.,,,,
울산대공원,JH Park,5.0,넓고 평화롭고 자전거 대여해서 빌리고 ~,,,,
울산대공원,동이민이빠,5.0,"아이들과함께하기 좋은거 같아요 산책하기도좋구요 자전거 타기도 좋구, 운동하기도 좋고 현재는 1월 27일까지 빛축제합니다 이뻐요 동물원등 다양한 볼거리가 많아요",,,,
울산대공원,정수웅,5.0,무료에 크리스마스나 연말 외에도 다양한 행사가 많으니 당얀히 추천! 특히 축제때는 주차요금을 받지 않는 때도 있습니다. 산을 끼고 있고 호수도 이쁘고 입구도 많고. 시내라 교통편도 편하니 추천합니다.,,,,
울산대공원,HS OK,4.0,우선은 굉장히 넓다. 갇혀 있는 동물들이 불쌍하긴 하지만 백공작이 날개 펴는 모습은 정말 환상이었다. 동물원 가는 길에 평상이 정말 좋다.,,,,
울산대공원,니이,5.0,무척 넓었어요. 동물원까지 가는데 너무 멀어서 자전거 대여했어요. 1인용이 1시간에 3000원 했습니다. 장미궁에 가니깐 종류가 무척 많았습니다. 포토존도 곳곳에 있었어요.,,,,
울산대공원,정승욱,5.0,"넓고 피크닉가기에 좋음. 그늘이 없는곳도 많기때문에 썬크림과 모자는 필수임.
자전거는 1인승 3천원 2인승 6천원이고 추가시간마다 추그요금이 부과된다. 카드가능
장미원 추천.",,,,
울산대공원,소울캐서린,4.0,아이들 놀이터가 구비가 잘 되어 있고 연령별로 놀수있게 구분되어 있지만 부모님이 제대로 알려주지않으면 큰아이들은 어린아이놀이터쪽으로 가기때문에 자칫 다칠수 있으니 부모님들이 이용시설안내를 읽고 자녀분들한테 한번더 알려주면 좋을듯해요. 그옆에 간이매점이 있지만 아이스크림은 없어서 아쉬워요~,,,,
울산대공원,연연이,5.0,운동하기  좋은 날씨라서  여유롭게 산책하는 사람  자전거 타는 사람  강아지들도 신나보이네요!    메타 스퀘어길도 있는건 첨 알았네요,,,,
울산대공원,Seol,5.0,별빛축제 때 방문함. 정문으로 들어가 연못 주변으로 산책하면서 사진찍고 놀다보면 1시간은 금방 지나감. 입구 쪽에 간단한 간식 파는 곳도 있음.,,,,
울산대공원,깜비누,5.0,"산책하기도 좋고 운동하는 사람들도 많고 강아지들도 많고 좋아요
근처에서 저녁먹으면 늘 한바퀴씩해요
헬스장 수영장도 있고 시민들을 위한 공원!!
요즘은 빛축제도 해서 더 예쁩니다👍🏻…",,,,
울산대공원,박지현,5.0,"울산맛집이에요
메뉴도다양하고맛도굿~~ㅎ
줄서서먹는곳이에요울산어린이대공원앞에있어요…",,,,
울산대공원,털없는원숭이,5.0,"울산 사람들 부럽네요
이런 좋은공원도 다있고",,,,
울산대공원,윤자매,5.0,"울산대공원에 있는 수영장 아쿠아시스를 방문했어요
코로나로 울산지역 주민만 이용가능하고 인원도 오전 오후로 나누어 선착순 200 명씩만 이용가능하여 붐비지 않아 좋았습니다. 단 일찍 가야 대기표 순번을 받아 이용가능하니 참고하셔요. 오전 시간대는 10:00~13:30분까지 이용가능하고 오후시간대는 15:00~16:30까지 이용가능합니다.",,,,
울산대공원,배영혁,5.0,"도심속 공간

자연경관과…",,,,
울산대공원,mg kim德昊,4.0,"휴일 밤 대공원 바람이 시원하구요!
빠른 걸음으로 걸어도 좋고,
느릿느릿 달팽이 걸음도 좋은…",,,,
울산대공원,Yoon Chang (Yoon),4.0,"장미축제 장미원 추천!
이외 대공원 자체 조경 등도 전반적으로 만족스럽지만, 오솔길에 아스팔트를 깔아놓는 점과 자전거 대여를 빌린 곳에서반 반납해야된다는 점 등 디테일한 부분에서 아쉬운 점이 조금씩 있는 공원.",,,,
울산대공원,김필,4.0,"울산 온지 어느덧  30년이 다되어간다.
첨 내려와서는  어디 갈곳도  마땅치  않아서 늘  바닷가로  가곤했다
울산대공원이  문을  열고부터는  아이들  어릴때~~…",,,,
울산대공원,이정아,4.0,빛축제를 1월21일까지 하는데 목도리 장갑끼고 가족들과 나들이 가면 좋아요~~ 따뜻한 차도 가져가면 더 좋을듯 프렌차이즈 커피숍도 가까이 있어요^^,,,,
울산대공원,윤효순,5.0,"울산시 중심에  넓은 공원 무료로 입장합니다
산책도 하고 아이들이 마음껏 뛰어 놀 수 있는 곳 입니다",,,,
울산대공원,황길균,4.0,"울산대공원에서

토요일 울산대공원 튜립축제 보러갔습니다.…",,,,
울산대공원,비사미,4.0,"대인 10000,어린이7000
일단 가격이 착해서ㅋㅋ 근처 사시는 분들 부럽네요. 야외는  마감해서 아쉬웠어요ㅜㅜ",,,,
울산대공원,Sang Kim,5.0,"도심속의 공원 누구나 어디에서나 슆게 찿아 산책을  할 수 있는 장소이네요
이번에는 호수가 밤 빛 축제로 방문을 하였습니다
손이 시려워서 ~~~",,,,
울산대공원,이태영,5.0,"좋네요ㅎㅎ
야간에 빛축제 하네요
다른곳에 가면 비싸게 표를 끊고 들어가서 봐야할 장면들을 무료로 즐길수 있네요…",,,,
울산대공원,Michael Song,4.0,"울산 옥동 주민이라면 한번쯤은 들러봐야할 곳이죠. 한적하고 좋습니다. 자연풍경도 좋고, 연못도 이쁘고요.ㅎㅎ",,,,
울산대공원,김상희,5.0,공기좋구~ 숲이라 좋은 울산대공원 노루보셨나요??^^ 전 봤지용~~^^,,,,
울산대공원,안영선,5.0,평일저녁 공원산책은 고즈넉한 정취를 느낄수 있음요. 6월13일까지 (9시)장미원 야간개장 중,,,,
울산대공원,Ent. J,5.0,"갈때마다 만족하고 오는 곳.
소중한 사람과 함께 산책하기 참 좋다.
주차장 잘 되어 있음.",,,,
울산대공원,Sue Park,5.0,"동문 서문 남문 으로 나뉘어서 각게이트별로 원하는곳으로 이동하기 좋고 게이트마다 주차시설완비
근처에 카페와 식당도 많음. 특히 브런치 카페는 유명한 베란다와 런던티가 있음.…",,,,
울산대공원,이정노,4.0,"장미축제가 있어 다녀왔습니다.
울산댁공원은 매우 넓기 때문에 방문 장소에 따라 주차장(정문, 남문, 동문)을 잘 선택하셔야 합니다. 그리고 그늘이 없어 여름에는 선크림 꼭 바르시고 양산, 얼음물, 휴대용 선풍기 필수로 휴대하시는게 좋습니다. 장미축제 보고 동물원도 보고 왔는데 가족, 연인 산책하는데 부족함이 없는 장소입니다.",,,,
울산대공원,SEIHOON LEE,5.0,자전거 빌려서 한 바퀴 돌면 한 시간이 금방 가는 넓고 깨끗한 공원이네요. 추천합니다.,,,,
울산대공원,허수,5.0,"울산대공원은 몇 배의 덩치가 큰 대한석유공사(약칭, 유공)를 인수한 선경( Sk)이 울산시민의 삶의 질과 휴식공간을 제공하기 위해 1,000억원을 들여 1995년 착공하여 2005년 완공하여 울산시에 무상으로 기증한 공원이다.
직물산업이 모기업으로 호텔등을 인수하고 기업을 확장하며 종합무역상사로 발돋음했다.…",,,,
울산대공원,종이,5.0,울산에 이렇게 멋진 야경과 빛축제를 하는지 몰랐네요~ 태화강 국가정원 십리대숲 은하수길과 함께 한다면 더할나위 없이 좋겠어요 ! 2020년 첫 국내여행 성공이었습니다아 !,,,,
울산대공원,정철호,5.0,"장미가 아름답게 피어있고 동물원에는 아이가 좋아하는 동물들이 많았음.
연인과 가족과 함께 오면 좋은 추억남기고 갈수있는곳임.",,,,
울산대공원,나야민,5.0,대공원은 자전거타기도 좋고 사계절 내내 구경해도 질리지않는 운동하기 좋고 아이들과 함께하기 좋은 그런 기분좋은 곳입니다,,,,
