place_id,user_id,score,comment
효정밥상,Junga Park,4.0,"게 철이라 싱싱한 게 맛을 볼 수 있었다.
주차장이 있긴 해도 주변에 주정차 차량이 많아 다소 불편하다.
그래도 1인당 1만원 가격대로 간장게장을 맛보는 매력 땜에 들른 곳.…"
효정밥상,김명석,4.0,"정말이지 오랜만에 간장게장을  먹으러 갔습니다.
생선구이 까지 추가하여  주문하였느데요.
나오자마자 맛이 기대가 되었는데요.…"
효정밥상,김민호,5.0,부산여행 갔다가 잠깐 울산에 볼일이 있어서 점심이나 먹을까하고 검색했는데 효정밥상을 선택하길 잘했네요^^ 그동안 다녀본 간장게장집 중에서 가성비 최고입니다. 가격만 저렴하고 맛이 없거나 상차림이 부실하다거나 하지 않습니다. 다른집들과 달리 간장게장에 고추가 많이 썰어져있어서 약간 매운향이 감돌면서 더 맛있습니다. 후식으로 먹는 식혜도 살얼음 동동 떠 있어서 겨울이여도 시원하게 입가심 잘 했습니다^^ ^ 오늘 비가 많이와서…
효정밥상,백진영,5.0,"가격완전저렴
게장도 짜지않고 담백하고
양도 많고 친절.
재방문의사 백프로"
효정밥상,bbui bbui,4.0,가성비 좋은 간장게장 집. 비록 가격이 꾸준히 상승하고있긴 하지만 부담스럽진 않은 수준. 간장게장 시키면 밥 두공기 뚝딱. 후식으로 식혜로 깔끔한 마무리 가능.
효정밥상,yh j,3.0,"가격대비 먹을만한 곳, 즉 가성비 때문에 가는데 점점 메리트를 잃고 있어요. 간장게장은 그럭저럭 먹을만 하고 반찬이 생각보다 괜찮아요. 포장은 현금만 받구요 웬만하면 포장 하지 마시고 가게에서 드세요. 집에 가져가면 엄청 비려집니다."
효정밥상,문명기,4.0,간장게장은 가성비 대비 양호함. 손님이 많으니 종업원이 약간 무뚝뚝하게 응대함
효정밥상,김용술,4.0,"가성비 최고의 게장정식
짜지도 않고 딱"
효정밥상,이영욱,4.0,"짜지않은 간장게장 그래서 그런지 비린맛은 좀 있는편 게가 크고 아름다워서 먹을건 많음. 달고짠 간장게장 좋아하시는분은 불호가 심할듯
어르신 입맛에 맞는편"
효정밥상,ji hea lee,5.0,"여기 간장게장 너무 맛있음.
여수나 순천 통영에 게장맛집이란 맛집은 다 가봤지만 여기 만한 간장게장을 파는 곳은 없다고 생각함.
1인분에 9000원이고 매일 신선한 게를 잡아 만들기 때문에 입맛 없을 때 한 번씩 가면 좋음."
효정밥상,이상호,4.0,간장게장 맛집. 울산에서 간장게장 먹고 싶다면 강추하는 곳. 달지않고 매콤짭짤한 간장게장. 함께나오는 젓갈과 김을 함께 먹으면 이집 최고의 조합. 식사시간에 맞춰가면 웨이팅이 있으므로 조금 일찍가는 것을 추천. 많이 드시는 분들은 둘이서 가면 3인분을 시켜 간장게장도 많이 먹고 공기밥도 한공기 반씩 드시기도 함. 생선구이 정식도 함께 판매하고 있는데 생선구이 정식도 나쁘지않음.
효정밥상,유수낙화,5.0,"간장게장은 싫어하는 성격인데 여기서 먹고나서부터는 여기 간장게장만 먹어요 비리지도않고 맛있어요
간장새우는 처음먹어봤는데 이건 입맛따라 차이날것같아요 저는 다 못먹었지만 옆자리는 새우를 더 맛있게먹더라구요 새우역시 비린맛은 전혀안나지만 제 입에는 역시나 간장게장!…"
효정밥상,김형미,5.0,"간장게장도 생선구이도 가성비 갑 푸짐 칠천원에 밥도 포함.반찬이 가끔 짤때가 있음^^ 숭융,두루치기도 맛있었음 디저트 식혜도 좋아요 소금과자도 맛나요~
2018 이젠 게값이 올랐는지 9천원 한다~ 양념게장도 있으면 더 좋겠다~"
효정밥상,Chevalier 1005,3.0,"3년전에는 간장게장 가성비 최고의 집 이었는데
최근에 다시  갔더니 가격이 많이 올랐네요.
1인분에 9천원이니 참고하세요."
효정밥상,H,3.0,"게장정식 주문!
모든 메뉴가 상당히 저렴해 가성비가 좋다"
효정밥상,지니,5.0,"짜지않고 맛있어요
밥에비벼 김에 싸먹으면 꿀맛입니다"
효정밥상,김한나,5.0,"수원사는데 울산시댁갈때마다 맨날가요~~
진짜 가성비 대박이고 양도많고 맛있어욤^^"
효정밥상,김혜경,4.0,"간장게장하면 생각나는 집
군더더기없는 맛
저렴한 가격에 간장게장을 배불리먹고 옴
다소 오래된 집같아보이지만 그만큰 연륜이 맛에서 느껴짐"
효정밥상,minjung kim,4.0,"맛있어요~~
밥 두 그릇 뚝딱. 나오는 밑반찬도 굳!
다 깨끗하게 클리어 했어요~ 저 반찬 두번 리필한거임"
효정밥상,심성보,4.0,간장게장맛집이라고하지만 개인별호불호가있은수있어나가겍만비싸고 머코나서후회함
효정밥상,김승용,4.0,"7000원할적엔 작은 게를 쓰다가 9000원인 지금은 게 사이즈가 조금 커짐
맛은 그냥저냥 간이 잘 안베어있을때가 많음
된장은 그냥 심심하게 먹어야함…"
효정밥상,이동화 (Matilda),4.0,게장을 못먹는 나로서는 평가가 어렵지만 데리고간 지인들은 기본 밥두공기 뚝딱!
효정밥상,SANGDON LIM,2.0,"가성비만 좋은듯입니다..
맛은 보통이하입니다..
된장찌개 이맛두 저맛두아닌 이상한맛..
댓글이 많은 이유는 가성비탓인듯.."
효정밥상,MG W,5.0,항상 저렴하고 맛있게 먹을수 있어서 가는곳
효정밥상,이영한,5.0,"가격대비 맛있고 양 진짜많아요
먹고나면 비린내가 좀 나니 장갑챙겨가세요 ㅋㅋ"
효정밥상,한예린,4.0,게장은 간장게장만 있는데 게장임에도 불구하고 전혀 짜지 않아요. 그리고 맛도 아주 깔끔합니다. 양도 많은 편이어서 밥 한 공기 뚝딱할 수 있습니다. 게장 먹고나면 식혜도 먹을 수 있어요. 게장 먹고 식혜로 입가심하면 최고입니다. 게장 먹으면 손이 더러워지기 마련인데 식당 출구에 손을 씻을 수 있도록 세면대가 마련되어있어 깔끔한 기분으로 나올 수가 있어요. 굳이 여수까지 멀리 가지 않고도 가까운 곳에서 맛있는 게장을 먹을 수 있어 좋아요
효정밥상,유영민,4.0,"게장정식이 유명하다고해서 몇번 가봤는데 게장이 좋게 말하면 짜지 않고 나쁘게 말하면 싱거워요ㅎ
된장찌개도 나오는데 역시나 싱겁더라고요
밑반찬은 집밥 느낌이에요"
효정밥상,서세실리아,3.0,"저렴한 가격으로 국산 간장게장을 먹을수있는곳
반찬,된장찌게등은 솔직히 맛이없고 간장게장만은
짜지않고 맛있음.…"
효정밥상,kijun baek,4.0,가격이 올랐네요 그래도 잘먹었습니다
효정밥상,youngho song,1.0,"게장에선 비린내가 너무나고 부족한 반찬  시키기도 어렵다. 종업원의 무뚝뚝함. 방 바닥에서 먹어야하는 불편함은 차지하고 생선구이도 너무 부실하다. 언제 구웠는지 말라버린 생선.  한 상에 하나 나오는 된장찌게는 4명이 먹기엔 턱없이 부족하고, 이 코로나 시국에 된장 들어 먹을 그릇도 주지 않는다. 들어 먹을 것 좀 주세요하니 큰 숟가락 두개를 준다....실소가 나온다. 앞 접시를 줘본 적도 없나 보다. 2명 이나 4명이나 같은…"
효정밥상,오승수,5.0,"오늘 장날이어서 조금 대기했구요!
간장게장 2, 새우게장 2, 두루치기(소) 해서 4인상 시켰더니 양이 많았지만, 너무 맛나 공기밥 2개 추가시켜 과식해도 꿀꺽꿀꺽 잘만 넘어가네요!…"
효정밥상,장문주,4.0,"비린맛없는 간장게장
한끼식사로 밥도둑이 따로없음"
효정밥상,김준수,5.0,"간장게장 엄청 맛있어요.
하지만 생각보다 맵습니다.
그리고 생선구이도 있으니 아이들이랑 같이 가도 좋아요. 식사를 마친후엔 식혜도 있어요.
주차자리가 7~8대 정도댈수 있으나 점심시간엔 주차하기 힘들지도 몰라요."
효정밥상,YK EOM,4.0,"최근에 갔을땐 좀 별로였어요..
좀 냄새가 났다고 해야하나..
항상 자주 찾는 집인데 좀 아쉬웠네요!…"
효정밥상,renelato,4.0,"간장게장이 맛집
다른메뉴 (생선구이 등)도 있긴한네, 간장 게장 추천
이상하게 직접가서 먹을땐 괜찮은데 포장해서 집에서 먹으면 그맛이 안남…"
효정밥상,냥e,5.0,"간이 세지않고 딱 적당한 흔치않은 게장집. 간장새우도 맛있게 잘먹었어용
(혼신을 다해 도구이용..ㅎ게장 특성상 손에 냄새 배는건 어쩔수 없어요ㅠㅠ)"
효정밥상,Jaeung Choi,4.0,"비린 맛 전혀없이 신선하고 살이 꽉찬 게장(간이 좀 심심하긴 하네요)이 일인분 9000원에 2마리가 나옵니다...반찬도 나쁘지않고요...가성비가 최고네요..
다만 아이 먹이려고 시킨 생선구이는 정말 별로네요 구워놨던것 같습니다. 게장 못먹는 가람들을 위한 메뉴인거 같은데 좀 더 연구가 필요할듯합니다..."
효정밥상,생각없을무,4.0,"저렴한 가격에 게장을 먹을 수 있는곳!
항상 사람으로 바글바글함
맛의 일관성이 없어서 별하나 뺏음…"
효정밥상,박상주,4.0,"간장게장은 전체적으로는 괜찮은 편이나 개인 취항에 따라 싱겁다고 느낄 수 있을 것 같고, 두루치기는 고기가 조금 퍽퍽해서 양념이 덜 배인 것 같고 생선구이는 생선을 너무 말린것 같다는 생각이 듦, 가격대비 괜찮은 것 같음!!"
효정밥상,Alex Ha,5.0,"가성비는 대박입니다. 솔직히 맛도 좋음.  (간장게장 기준)

좀만 더 깨끗한 느낌이 들었음 좋겠는데 낡아서 어쩔수 없는건지 ...?…"
효정밥상,순댓국집,4.0,가격대비 나쁘지않아요 게장이 맛있고 새우장은 너무 많이먹으면 물린다해야하나 간장만팔아서그럴수도있고 하지만 가격대비 양과 맛은 나뿌지않습니다 점심시간대가면 사람많습니다 그거 유의하고 가주세요
효정밥상,김현성,5.0,여기는 제가 몇년째 단골인 식당입니다. 간장게장의 맛이 아주 휼륭하고 식사를 마치고 깔끔한 식혜로 입을 마무리 할 수 있습니다. 기회가 되신다면 꼭 방문해보시길 바랍니다.
효정밥상,서정민,1.0,"간장 게장 진짜 맛없음  이게 무슨맛이고  손에서  비린내가
아직  가시질않네 리뷰 좋은이유를 모르겠네요 지인분들이 남긴건가?? 반찬도 너무 부실하고 된장찌개는  너무 싱겁고  한번 가면  다시 가고싶지않는 집입니다"
효정밥상,김아미,4.0,"가성비는 나쁘지않았어요 살도많구요..근데 맛이 많이 안 베어든 느낌..
방금 만든것같은맛? 그냥 게 생살 맛에 간장이랑 고추랑 먹는느낌..어떤게딱지는 엄청떫기도했고.."
효정밥상,햇살의흔적,3.0,간장게장과 간장새우를 먹었습니다. 짠맛이 약한편이라 부담없이 먹을 수 있어 괜찮았습니다. 다만 단맛도 약한편이라 심심할 수 있네요. 그럭저럭 맛있게 먹었습니다.
효정밥상,울산자유인,5.0,"간장게장 1인분 9,000원 (작년에는 7,000원하던 게장이 가격이 오른지 한참 되었지만) 들어가면서 셀프로 식혜1잔 떠서 기다리면 간장게장이 나오고 나오면서 100원 설탕커피(헤즐넛향) 한 잔 마시고 나옵니다. 오늘은 팥시루떡(사장님께서 집안행사가 있으면 손님들 드시라고 많이 하십니다)도 먹고 나왔지요. 정성도 맛도 굿입니다. 제가 MSG가 많이 들어갈 걸 먹으면 속이 더부룩하고 머리도 아파서 몸이 먼저 반응을 보내는데 여기는 제가 몇년째 간장게장 먹으러 다녀도 맛이 깔끔한 건강한 먹거리입니다. 참 좋아요"
효정밥상,BigZero Gold,4.0,"난 간장게장을 자주 먹진 않는데 먹을만 했다.
게장정식 9000원이다.
아는 형은 나도 보다 간장게장을 자주 먹는데 아주 깊은 맛은 없는데 그래도 먹을만 하다고 한다. 여기서 먹고 덕하시장 구경하면 괜찮을 듯 덕하시장은 상설시장이 아니라서 검색해보고 가시길"
효정밥상,b suwan,5.0,가성비최고 간정게장집이라고 생각해요. 게장 직접담구는 모습도 볼수있고 직접담그는 만큼 하루에 엄청 많은 양을 팔진않아요 그래서 브레이크타임도 있어요!
효정밥상,상영관은3관입니다,3.0,"착한가게로 인증받은집.. 장사 잘되서 가격올리고 초심잃었나봄.
만원임. 먹으면 배가 고픈상태.이젠 가성비가 아님."
효정밥상,Jaeseok Yang,5.0,맛있고 저렴함 주차장이 조금 협소함
효정밥상,박은경,4.0,간장게장 맛집인가봐요.  주말 1시쯤이였는데 손님들로 꽉차 있었어요.  쉼없이 손님이 들어오고 나가고 쉼없이 간장게장이 나오고  이 많은 게들은 어디서 왔는가... 짜지 않고 저렴한 가격이라 인기인것 같아요. 된장찌게가 나오는데 사장님이 직접담그신다고 하네요. 음식점에서는 보기드물죠. 저는 간장게장을 좋아하지 않아 생선구이를 먹었는데 꽁치랑 서대가 나왔어요. 모든 음식이 짜지않아 좋았어요. ㅎㅎㅎ 그날 생선구이 먹은 사람은 나뿐이였던 듯 하네요
효정밥상,정영규,2.0,"추천으로 간 덕하시장내 간장게장 정식^^가격싼게 비지떡이라고 지인에게 추천하면 좀 안좋은 식당~
반찬가지수 적고,식당분위기 산만,게장도 좀시원찬
찬거리~조금 1~2천원 더 가격을주더라도 그곳으로
추천~~*"
효정밥상,구현,1.0,최악입니다.. 만원에 싱싱한 게 2마리까지는 좋았는데 돈주고 사먹을 수 없는 쓴맛나는 게장이라니.. 아마도 간장을 돌려쓰다가 맛이 간거같은데 테스팅도 안해보고 음식을 판매하나보네요.. 저는 절대 다시 안갑니다
효정밥상,Seungtae Hong,5.0,"울산분들은 좋겠어요

이런 가성비 최고 음식점이 있으셔서..…"
효정밥상,윤희준,4.0,맛있다고 추천받아 갔는데요 간장게장량은 많이 줍니다. 맛도 그럭저럭 비릿네 안나고 먹을만 했구요
효정밥상,김선영,5.0,간장게장 짜지도 않고 매콤하며 밥도둑임*.*여기오면 기본 두그릇 이상은 먹고 갑니다^^강추강추♡♡♡포장은 안된대요ㅠㅠ이부분은 아쉽아쉽
효정밥상,이지민 (Zzi),5.0,가격이 좀 올라서 슬프지만 그래도 싸고 맛있어요. 단점은 올때마다 게장 상태가 달라요 어떤날은 싱겁고 어떤날은 해동이 덜 되었고.. 그래도 전반적으로 강추하는 가게에요
효정밥상,최규종,2.0,생선정식이랑 게장정식 두 개씩 시켰어요 이른 시간이라 그런지 손님이 많지는 않았어요 게장 좋아해서 자주 갔던 곳인데 최근에는 바빠서 못 가다가 오랜만에 왔는데 가격이 많이 올랐네요 ㅠㅠ 가성비가 최고인 식당이었는데 그래도  기대하며 기다렸어요 게장 정식은 예전이랑 크게 다르지 않았는데 생선구이 정식이 조금 실망스럽네요 생선 종류도 두종 뿐이고옆테이블나온 일인분이랑 크게 다르지 않아 맘상했네요 생선구이정식은 다음에 시키지않거나 아이들있으니깐 일인분만 시키려구요 게장정식 드시러가세요 그리고 게장은 포장해오시는것도 괜찮을거같았어요
효정밥상,Rsp _ “잡스스티븐[jjh]” JJH,1.0,"맛있게, 잘먹었는데 (진짜 ㄹㅇ맛있었음ㅎㅎ) 그런데 , 20000어치 포장했는데... 아까먹은 간장게장이 사래들침..  하여튼, 사실 거기서 20000원 울산페이 결제되거는요? , 근데 사장(?)님 할튼 그사람이 울산페이 수수료 나간다고 현금결제 하라함 여기서 잠깐 울산페이는 수수료를 0%로도 부가하지 않고 (소득공제)라서 그사람들이이득인데 그러고 현금영수증까지 내려달라해도 안내려주시는 사장님클라쓰... ㄷㄷ 결론: (가계만가서먹자 , 왜냐하면 더비싸고 사장님(?)클라쓰를 맛볼수있다."
효정밥상,홍영미,5.0,간장게장  넘맛있구.생선구이도 맛나구요.김에싸먹고.게딱지에 밥비벼먹고.지금 넘많이먹어 집에도착하여 소화제먹었어요.맛있다고 과식하지마세용.ㅎㅎ
효정밥상,김용한 (James Kim),4.0,두루치기 평범해요 밑반찬이 괜찮아요. 서빙하는 여직원분이 좀금만더 친절해도 좋을텐데 말이죠.
효정밥상,재욱석,3.0,주인이 바꼈는지 서빙분 인상도안좋고..서비스가 예전과 다름..맛은 예전과 같았는데..ㅜㅜ아쉽내요..
효정밥상,강경자,4.0,저는 자주가는편이고 다른식당에비해 저렴한가격 깔끔한반찬 특히간장개장이너~무 맛있어요 근데요즘 양이조금줄어드는거같아서안타갑네요
효정밥상,뭘뭘뭘!!! (뭘!!!),5.0,간장게장만 두접시를 먹어치우고 왔어요.맛나고 간장새우를 못 먹었다는게 아쉬운만 남기고 다음 기회를 두고 가볼생각입니다.
효정밥상,류영수,5.0,"인생 맛집이라해도 부족함이 없음
도대체 이 가격에 어떻게 가능한지 궁금함.
인심 넉넉하고 친절도 덤."
효정밥상,Junu Jo,5.0,"밥도둑 게장정식과 생선구이 정식까지 굿..
식사 후 흐드러진 목련꽃을 보며 봄의 청취도 느끼고.."
효정밥상,송윤기,4.0,그냥 갠 적으로는한번 정도 가볼만하고요 때기는 맛은 아닌듯.
효정밥상,김혜미,4.0,가격대비 양이 많네요
효정밥상,김현주,3.0,게장의맛은짜지않고비린내가없어가성비괜찮으나밑반찬의맛이떨어지고신선하지않음 손을씹고싶었으나화장실에비누도비치되않아위생면이나서비스가미비함 비린내나는손으로집까지가니기분이깔끔하지않음
효정밥상,임태훈,4.0,울산부근에서 간장게장 으뜸입니다. 어떤신사분이가도. 두손걷어붙입니다. 하나더 입구에식혜가 신의한수가. 될수도 있어요
효정밥상,SeeU Weapon,5.0,"맛 굳
가격 굳굳
동네맛집인지 장날늦은점심에왔는데도…"
효정밥상,김제경,2.0,가성비 좋아서 추천했는데 1인분 7천원>9천원 올랐습니다. 가성비 별로 입니다. 위치도 안좋고 굳이 그 돈 주고 거기가지는 않을 것 같습니다..
효정밥상,김창호,5.0,"간장게장 아~주 만족 합니다.새우간장도 있네요.매장식8마리, 포장10마리 일인분"
효정밥상,김체어멘!!!,3.0,"역시 가성비는 최고임 간장게장은 싱거우나 밑반찬도 맛이좋고 다만 비닐장갑이 필요함
새우도 추천함"
효정밥상,회야강,4.0,간 짜게한다고 손님들이 뭐라 했는지 게장이 아니라 그냥 간장에 담갔다 건진것같은 게장. 그래도 가성비는 나쁘지않음.
효정밥상,도깨비,4.0,"맛있는 게장백반을 먹을 수 있는 곳이죠, 가격과 맛 모두 만족, 단 점심 시간 사람 많습니다. 포장도 괜찮아요."
효정밥상,고석훈,4.0,"간장게장이 맛있어요.가격도 저렴 합니다.
1인분 만이천원이며 양도 푸짐 합니다."
효정밥상,seong ho park,1.0,"입 소문이나 손님이 많아졌어요
그런데 손님을 맞이하는 젊은 사장님께서
예약도 안하고 손님 많을때 자리가 어디있냐고…"
효정밥상,사공슈터,3.0,저렴하게 게장정식 좋네요
효정밥상,루재니재니,5.0,"가성비가 갑.
장사가 잘돼 숙성기간은 길지 않은듯...
입맛 까다로운분은 패스.
이가격에 이정도면 쵝오."
효정밥상,안지은,4.0,"게장1인분 9000원ᆢ싱싱한 게에 맛있게 먹었어요ᆢ사진은2인분ᆢ생각날때마다 가요
근데 생선구이는 노노노ᆢ꽁치한마리에 말라붙은이름모를생선하나 9000원ㅠㅠ
게장포장도 별로 만원에2마리~
포장이 더비싸용ᆢ"
효정밥상,김영훈,3.0,저렴하긴한데 장사가 잘되서 그런지 간이 게살에  덜 배인거 같고...직원들이 전체적으로 힘든지 미소가 없고 무뚝뚝한듯 합니다.
효정밥상,Joe Ahra,5.0,징짜 갓성비..최고입니다. 사진을 못 찍었네요.. 아쉽지만 알있는 게장은 아니에요~ 그래도 9천원에 이정도면 최고인듯.
효정밥상,오정선,5.0,간장게장이 짜지않고 가격 좋아요
효정밥상,박재홍,5.0,간장게장 싱싱하고 가격대비  맛은 좋아요 근디 사장 아들분  너무 불친절 손님이 너무 많은 가바요 사장님 사모님은 친절  아예  다른 종업원 고용 하시는게 나을듯 싶습니다
효정밥상,호호,4.0,게장 살도 꽉차고~함께 나오는 생선구이도 맛있고~된장찌개도 맛있어요
효정밥상,SB KIM,3.0,가성비가 식당선정 기준의 첫번째라면 방문 할만 함. 점심시간은 피할것
효정밥상,Kyeyong Song,1.0,반찬울  거이 던지드시 하다가 바지에  국물이  흘러는데  그냥  미안합니다....  하마디 .. 서비스  최악
효정밥상,hokil bang,5.0,가격저렴. 맛 좋음.
효정밥상,김한경,1.0,현금과 카드 사용 차이를 많이 두어서 기분이 매우 않 좋았네요 다시는 가고 싶지 않아요
효정밥상,허원,5.0,가성비 집밥 느낌
효정밥상,서지윤,5.0,1인분에 게도 2마리씩주고 양도 많고 존맛탱입니다 혼자 밥 2그릇 먹어버리고 왔어여
효정밥상,최광일,5.0,가성비 만점 입니다. 맛있어요
효정밥상,식도락(울산 식도락),2.0,"게장도 비리고 간도 안맞음 살은 있는편임
된장찌개도 맛이 없음 반찬도 별로"
효정밥상,Gkoon,3.0,가격이 미친듯이 오르고 있음 봄 가을 말고는 게 상태가 너무 말랏음
효정밥상,이상호,5.0,사진 못찍은것이 후회됨. 맛있어요
효정밥상,여린,1.0,이렇게 맛없는 게장은 처음인데 장사가 잘되는 이유를 모르겠어요 양 많으면 뭐함 맛이 없는데 리뷰 좋은 이유를 모르겠네
효정밥상,김대현,4.0,개장정식 9천원에 완전 푸짐함
효정밥상,현상인,4.0,효정밥상은 예전에 가격은 좀 많이 저렴 했는데 요즘은 조금 비싸 졌어요 하지만 지큼 가격에 이만한곳 없어요 가격 맛 괜찮아요^^
효정밥상,임현택,5.0,"울산 착한가격업소 900호점
게장이 푸짐합니다. 맛있습니다. 한번 가보세요. 덕하시장 옆에 있습니다"
효정밥상,조명화,4.0,짜지않고 맛있고 가격대비 양도 많아요. 식당 건물이 오래되어서..  쫌
효정밥상,정동현,5.0,"간장게장 집으로 짜지 않고 맛있습니다
옛 말에 게장은 밥도둑 이라는 말을 실감 하실수 있습니다"
효정밥상,이진옥,5.0,"간장게장 먹었는데 매운 거 못먹는 나도 맛있게 먹음. 비리지도 않고 짜지도 않고.
꿀맛"
효정밥상,Taek-Min Kim (김택민),5.0,뭔 이런 식당이 다 있냐.. 싸고 맛있고 양많고.. 어이없어요 .. 추천
효정밥상,이강희,4.0,간장게장을 맛있게 먹을수 있는 특별한 맛집입니다
효정밥상,CY P,5.0,게장 싸고 푸짐하고 정말 맛있어요 후식으로 먹는 식혜가 꿀맛입니다
효정밥상,진감동,3.0,가성비 좋고 맛있으나 불친절... 들어갈때 나갈때 인사도 없음. 나만 잘먹었다고 인사하고 옴
효정밥상,조승욱,1.0,"6000원이였을때 가성비 좋은집

지금은 9000원. 이돈으론 더맛있는 게장집을 감"
효정밥상,MING SEO,3.0,"게장은 최고.
새로 생긴 새우장도 튼실하니 좋던데
두루치기는 옛날같지 않았어요."
효정밥상,임병탁,5.0,울산에서 저렴한가격에 간자계장을 먹을수있는 식당입니다 가격대비 맛이있어요
효정밥상,강철진,5.0,엄청 추천해요
효정밥상,문광수,5.0,게장이 참 맛있어요~ 그보다 식혜가 정말정말 맛있어요 식혜 맛집임!!
효정밥상,Hong Jong Keun,1.0,게장 비리고 생선구이는 눅눅하고 싱거웠음. 같이 나오는 된장찌게는 밍밍했음.
효정밥상,배봉선,4.0,게장이저렴한가격인데도참맛나고기다림도없고좋았어요.된장찌게도맛났구요.
효정밥상,WookJoon Hwang,4.0,"대여섯번 포장만 했지만
코로나 끝나면 꼭 가서 먹어보고 싶은집~♡"
효정밥상,최승철,4.0,간장게장 맛집입니다.가격 착하구요 게장맛이 짜지않고 맛있어요.
효정밥상,정남기,4.0,"오랫만에 찾았는데 여전히 맛있었다.
짜지도않고  저당한맛에 비린네도 없이
만족한 한끼였다."
효정밥상,Yunsu Park,4.0,맛있고 깔끔해요.. 성인남자2명갔는데 살짝 양이 부족함
효정밥상,김종원,1.0,생선구이는 별로네요 구워논거 다시구워서 기름투성이 도저히손이안감 된장찌게에 밥먹고패스 다시는가기싫음
효정밥상,busan강사장,1.0,생선정식먹고 오바이트했어요.오바이트하면서 눈이튀어나오는줄ㅡㅡ 사장한테 말했더니 병원갔다오라고ㅡ밥값이 아까웠어요
효정밥상,이지원,5.0,정말 최고ᆢ 푸짐한양과 저렴한가격.
효정밥상,김종일,4.0,저렴하고 맛좋습니다 간장게장 좋아하신다면 한번쯤 들를만한 좋은곳입니다
효정밥상,김용훈,3.0,"매번 맛이 조금씩 달라지는 게장맛?ㅡㅡ
곧 만원을 넘길듯한 가격...이젠 가성비 갑이라는 말은 못하겠다."
