place_id,user_id,score,comment
화봄,바람식객,5.0,카페라떼. 부드럽고 풍부한 맛. 은은한 향.
화봄,춘식이분모자,5.0,딸기케이크 로컬맛집 ❤️
화봄,주우👀,5.0,딸기 케이크 맛집.. 라떼도 맛집...😍
화봄,깜짝맘,5.0,
화봄,jjj,5.0,갬성 낭낭딸기라떼 맛있어요친절하신 사장님은 덤♡
화봄,@톡 무음임,4.0,커피맛 괜찮고 에이드 도 시켰는데 탄산수를 더주시네요ㅋ매우 친절하신 사장님 까지
화봄,pentatonic,5.0,"아인슈페너, 자몽에이드, 생딸기 케이크 주문해서 마셨는데 다 맛있었어요 :)  특히 아인슈페너 넘나 맛있어요카페 오너분이 직접 케이크를 만들어서 판매하시는데 찻잔 하나, 유리컵, 접시 전부다 정말 예쁜 것들로만 구비해서 친절하게 서빙해주셔서 참 좋더라구요맛있게 먹느라고 카페전경 사진을 미처 못 찍었네요. 테이블은 2인용 4곳이랑  카운터 바로 앞에 대략 4인정도 앉을 수 있는 테이블이 있어요. 흔들의자 앉아있으니 어느새 흔들게 되는 편안함이 있네요. 화장실은 파우더룸 통과해서 왼쪽으로 나가면 있구요. 소변기와 대변기가 한 공간에서 칸막이로 완전히 분리되어 있는 형태였어요. 우리 동네에서 젤 맘에 드는 또가고 싶은 카페였어요. 담엔 마스카포네 티라미수 먹어야지!  영업마감시간은 오후 10시입니다."
