place_id,user_id,score,comment
금천면관,맛집찾기,5.0,내맛집🫶🏻♥️
금천면관,윤's,5.0,금천면관 보기만했지 와보진 않았는데 마침 울산 놀러왔다가 방문하게됬는데 정말 너무 맛있더라구요!!! 직원분들도 너무 친절하심~~맛잇게 먹구갑니다!
금천면관,지나가는 행인,5.0,울산여행은 태어나서 처음인 사람입니다. 지인 추천으로 금천면관 방문했는데 공항과의 거리도 가까워서 참 좋았어요! 3대 짬뽕답게 국물만 먹어봐도 어떤 느낌인지 알 것 같아요. 근처에 살지않는게 안타까울 정도입니다ㅠㅠ번창하세요!
금천면관,오태,4.0,괜찮네요. 짜장은 주류가 아닌듯하고 짬뽕은 내용물도 풍성하고 굉장히 맛났어요!
금천면관,비매품,5.0,중식을 먹고 한번도 신선하다는 생각을 해본적이 없는데 밑반찬부터 요리까지 굉장히 신선했고 직원분들도 친절하시고 인테리어도 깔끔합니다간짜장에 밥을 호로로로로로로로로록 비벼 먹고 다이어트 결심한지 한시간만에 실패했습니다...
금천면관,김동원,4.0,
금천면관,정해주,4.0,우리 동네지만 밑반찬으로 나오는 피클과 단무지 피클등이 다른 중국집과 다르고 계속해서 먹게 됩니다. 그리고 음식도 깔끔합니다.
