place_id,user_id,score,comment
오복미역 울산삼산점,유재영,5.0,반찬이 정갈하게 나와서 좋았고 전복가자미 미역국 주문했는데 혜자스럽게 나와서 맛있게 먹음
오복미역 울산삼산점,Dongmannnnn,5.0,
오복미역 울산삼산점,.,5.0,맛있음
오복미역 울산삼산점,개같으면짖는개,5.0,진하고 맛있고
오복미역 울산삼산점,정상원,1.0,조개미역국 포장했는데 새끼손톱만한  껍질이 나왔네요...이빨 깨질뻔.....자주 가던 곳인데 이젠 안가려구요
오복미역 울산삼산점,장주,2.0,맛있는데 올때마다 물에서 냄새나요물관리좀 해주세요맛나게먹고 물마시면 기분나빠져서 가네요
오복미역 울산삼산점,최준민,1.0,소고기미역국 시키니돼지고기 미역국 나옴.
오복미역 울산삼산점,j,1.0,"진짜맛없어요... 육수는 괜찮은데 싼미역에 질기고, 반찬은 간않맞고, 쌀밥도 별로.. 홀담당하시는분들 불친절.. 조선족분들.."
오복미역 울산삼산점,재곤,4.0,가격보고 뜨억 했는데 요즘에는 이정도 되야 제대로 된 빕을 먹을 수 있나 보군요.미역국이 왜이렇게 비싸냐고 할 수 있지만 같이 나오는 반찬이 정갈 합니다.나오는데 시간이 오래 걸리긴 하네요.
