place_id,user_id,score,comment
나사해수욕장,CURIE KIM,5.0,조용하고 주말인데도 사람이 많지 않아서 너무 좋아요ㅎㅎ 원래 임랑 자주 가다가 임랑이 많이 붐비게 돼서 새로운 해변 찾고 있었는데 오는 길에 차도 많이 없어서 편하고 해변도 아담하고 잔잔하고 참 좋네요♥︎
나사해수욕장,둥둥파,1.0,정말정말 비추천 평생 앞으로 갈일 없기를아이들 있다면 진해로 가세요
나사해수욕장,이민영,4.0,
나사해수욕장,ㅇㅇ,1.0,평점 제로 두번다시 안오고 싶은 동네네요ㅠㅠ평상 안 빌리면  주차도  못하게 하는데  자기네들이  임대를  했다고  하네요 어디서부터 어디를   누구한테 임대를 했는지  정말 궁금합니다
나사해수욕장,신비,1.0,여기 주민들의 이기심은 하늘을 찌르네요바가지에 인성들이참...
나사해수욕장,White whale,1.0,
나사해수욕장,Track,3.0,아이입장-예쁜 조개가 많아서 줍는 동안 즐거웠어요. 아빠입장-지나가다 잠시 들러 바람쇠기 좋아요
나사해수욕장,석수영,3.0,
